{
  "bundle_id": "bundle-1",
  "issued_at": "2026-08-08T00:00:00Z",
  "locators": [],
  "manifest_digest": "sha256:0000000000000000000000000000000000000000000000000000000000000000",
  "mission_id": "delivery-example",
  "receipt_root_digest": "sha256:0000000000000000000000000000000000000000000000000000000000000000",
  "schema_version": 1
}
